{
  "schema": "core-module/v1",
  "id": "epay",
  "version": "1.0.0",
  "kind": "connector",
  "execution": "in-process",
  "lifecycle": "payment-owner",
  "kernel_api": {
    "min": 1,
    "max": 1
  },
  "requires": [],
  "boot_after": [],
  "operations": {},
  "subscriptions": [],
  "config_schema": {
    "type": "object",
    "properties": {},
    "required": [],
    "additionalProperties": false
  },
  "schema_version": 0,
  "secrets": [],
  "connector": "payment"
}
